{
  "schema_version": 1,
  "router_id": "programme-003-quantitative-research-knowledge",
  "programme_issue": 353,
  "phase_issue": 354,
  "purpose": "Route Commodity quantitative-research and engineering questions to authoritative sources and executable repository rules without replacing canonical methodology.",
  "canonical_methodology_owner": "config/research_methodology.json",
  "agent_usage": {
    "rule": "Consult this router before designing or changing forecasting, financial-ML, data-engineering, temporal-integrity, backtesting, or production-monitoring behavior.",
    "skill_boundary": "Reusable procedural skills remain live KIS skills; this repository artifact is domain knowledge and routing authority, not a local skill catalogue.",
    "precedence": [
      "AGENTS.md",
      "canonical repository config/contracts",
      "config/quantitative_research_knowledge.json",
      "cited external sources"
    ]
  },
  "sources": {
    "ml4t3": {
      "title": "Machine Learning for Trading, 3rd edition repository",
      "authors": ["Stefan Jansen"],
      "tier": 1,
      "url": "https://github.com/stefan-jansen/machine-learning-for-trading",
      "access": "Public GitHub repository; rolling third-edition material.",
      "license_or_copyright": "Repository code is MIT where declared; book content remains copyright of the author and is not copied into Commodity.",
      "authority_domains": ["financial_ml_research", "feature_engineering", "model_selection_and_tuning", "backtesting_and_trading"]
    },    "fpp3": {
      "title": "Forecasting: Principles and Practice, 3rd edition",
      "authors": ["Rob J Hyndman", "George Athanasopoulos"],
      "tier": 1,
      "url": "https://otexts.com/fpp3/",
      "access": "Public online textbook; website content is cited rather than copied.",
      "license_or_copyright": "Book-text reuse rights are not inferred from the GPL-licensed companion software; Commodity stores only distilled rules and citations.",
      "authority_domains": ["forecasting", "feature_engineering", "forecast_evaluation"]
    },
    "fde": {
      "title": "Fundamentals of Data Engineering",
      "authors": ["Joe Reis", "Matt Housley"],
      "tier": 1,
      "url": "https://www.oreilly.com/library/view/fundamentals-of-data/9781098108298/",
      "access": "Publisher-hosted book; access may require O'Reilly subscription.",
      "license_or_copyright": "Copyrighted publisher content; Commodity stores distilled principles and citations only.",
      "authority_domains": ["data_engineering"]
    },
    "dmls": {
      "title": "Designing Machine Learning Systems",
      "authors": ["Chip Huyen"],
      "tier": 1,
      "url": "https://www.oreilly.com/library/view/designing-machine-learning/9781098107956/",
      "access": "Publisher-hosted book; access may require O'Reilly subscription.",
      "license_or_copyright": "Copyrighted publisher content; Commodity stores distilled principles and citations only.",
      "authority_domains": ["temporal_integrity_and_leakage", "model_selection_and_tuning", "production_monitoring"]
    },    "ddia2": {
      "title": "Designing Data-Intensive Applications, 2nd edition",
      "authors": ["Martin Kleppmann", "Chris Riccomini"],
      "tier": 2,
      "url": "https://www.oreilly.com/library/view/designing-data-intensive-applications/9781098119058/",
      "access": "Publisher-hosted book; consult only when deeper infrastructure reasoning is needed.",
      "license_or_copyright": "Copyrighted publisher content; Commodity stores distilled principles and citations only.",
      "authority_domains": ["data_infrastructure_deep_dive"]
    }
  },
  "routing": {
    "data_engineering": {
      "question": "How should data be generated, ingested, stored, transformed, orchestrated, served, governed, or observed?",
      "primary_sources": ["fde"],
      "secondary_sources": ["ddia2"],
      "owner_refs": ["config/data_sources.json", "config/research_dataset.json", "data/acquisition-recipes/"]
    },
    "forecasting": {
      "question": "How should baselines, transformations, diagnostics, forecast models, uncertainty, or forecast evaluation be designed?",
      "primary_sources": ["fpp3"],
      "secondary_sources": ["ml4t3"],
      "owner_refs": ["config/research_methodology.json", "tests/evaluation/"]
    },
    "financial_ml_research": {
      "question": "How should an end-to-end financial ML research workflow be designed and evaluated?",
      "primary_sources": ["ml4t3"],
      "secondary_sources": ["fpp3", "dmls"],
      "owner_refs": ["config/research_methodology.json", "research/programmes/"]
    },    "feature_engineering": {
      "question": "How should market, calendar, physical, or model-derived features be constructed without leakage?",
      "primary_sources": ["ml4t3"],
      "secondary_sources": ["fpp3", "dmls"],
      "owner_refs": ["config/research_methodology.json", "config/research_dataset.json"]
    },
    "model_selection_and_tuning": {
      "question": "How should candidate models, hyperparameters, calibration, and selection budgets be controlled?",
      "primary_sources": ["ml4t3"],
      "secondary_sources": ["dmls", "fpp3"],
      "owner_refs": ["config/research_methodology.json", "config/models.json"]
    },
    "temporal_integrity_and_leakage": {
      "question": "How should event time, availability time, versions, training-serving boundaries, and leakage controls be enforced?",
      "primary_sources": ["dmls"],
      "secondary_sources": ["ml4t3", "fde"],
      "owner_refs": ["config/research_dataset.json", "config/research_methodology.json"]
    },
    "backtesting_and_trading": {
      "question": "How should signals be translated into executable fills, held contracts, costs, positions, rolls, and P&L?",
      "primary_sources": ["ml4t3"],
      "secondary_sources": ["fpp3"],
      "owner_refs": ["config/trading-policy.json", "config/simulation.json", "config/signal_policy.json"]
    },
    "production_monitoring": {
      "question": "How should feature freshness, drift, retraining, serving behavior, and operational health be monitored?",
      "primary_sources": ["dmls"],
      "secondary_sources": ["fde", "ddia2"],
      "owner_refs": ["config/models.json", "config/data_sources.json"]
    }
  },  "playbooks": {
    "temporal_integrity": {
      "purpose": "Make every model input reconstructable at the decision timestamp.",
      "rules": [
        {"order": 1, "rule_id": "temporal_integrity-availability-clock", "instruction": "Record event time, availability time, source, version/as-of identity, and revision state for every forecast input whose publication can lag observation.", "source_ids": ["dmls", "fde"], "owner_refs": ["config/research_dataset.json", "config/data_sources.json"]},
        {"order": 2, "rule_id": "temporal_integrity-point-in-time-join", "instruction": "At each decision timestamp, join only records whose declared availability time is not later than that timestamp; fail closed when timing cannot be defended.", "source_ids": ["dmls", "ml4t3"], "owner_refs": ["config/research_methodology.json", "config/research_dataset.json"]},
        {"order": 3, "rule_id": "temporal_integrity-train-only-transform", "instruction": "Fit scaling, imputation, encoding, feature selection, calibration, and learned transformations inside the active training fold only, then apply them forward.", "source_ids": ["ml4t3", "dmls"], "owner_refs": ["config/research_methodology.json"]},
        {"order": 4, "rule_id": "temporal_integrity-protected-evidence", "instruction": "Keep reserved-confirmation outcomes unread and unusable during design, fitting, tuning, calibration, model selection, threshold selection, and feature revision.", "source_ids": ["ml4t3"], "owner_refs": ["config/research_dataset.json", "config/research_methodology.json"]}
      ]
    },
    "target_definition": {
      "purpose": "Bind the forecast target to the intended trading decision and executable exposure.",
      "rules": [
        {"order": 1, "rule_id": "target_definition-decision-window", "instruction": "Declare decision timestamp, target start/end, forecast horizon, target units, and contract/roll identity before model fitting.", "source_ids": ["fpp3", "ml4t3"], "owner_refs": ["config/research_methodology.json", "config/trading-policy.json"]},
        {"order": 2, "rule_id": "target_definition-information-cutoff", "instruction": "Construct labels so no value published or realized after the decision timestamp enters a predictor or selection statistic.", "source_ids": ["fpp3", "dmls"], "owner_refs": ["config/research_dataset.json"]},
        {"order": 3, "rule_id": "target_definition-overlap-control", "instruction": "Identify overlapping target windows and require purge, embargo, or dependence-aware evaluation whenever overlap can leak label information across folds.", "source_ids": ["ml4t3"], "owner_refs": ["config/research_methodology.json"]},
        {"order": 4, "rule_id": "target_definition-forecast-vs-execution", "instruction": "Keep the statistical forecast target separate from signal policy and executable P&L accounting; document the translation explicitly.", "source_ids": ["ml4t3", "fpp3"], "owner_refs": ["config/signal_policy.json", "config/trading-policy.json"]}
      ]
    },    "feature_engineering": {
      "purpose": "Create features whose timing, transformation, and missingness are reproducible out of sample.",
      "rules": [
        {"order": 1, "rule_id": "feature_engineering-lineage", "instruction": "For every feature family, record raw source, timing semantics, transformation, lag, revision behavior, and the decision-time availability rule.", "source_ids": ["ml4t3", "fde"], "owner_refs": ["config/data_sources.json", "config/research_dataset.json"]},